{
  "jurisdiction": "cn",
  "regulation_name": "生成式AI管理暫定弁法ほか分野別規則群（アルゴリズム推薦・深度合成・AI生成コンテンツ標識）",
  "status": "in_force",
  "approach": "sectoral",
  "axes": {
    "risk_classification": {
      "summary": "EU型の横断的リスク階層はない。サービス類型別（推薦アルゴリズム・深度合成・生成AI）の規則を積み上げる方式。",
      "detail": "包括的AI法は未制定（人工知能法は立法計画に登場するが提出時期未定）。実務はアルゴリズム推薦管理規定（2022-03施行）、深度合成管理規定（2023-01施行）、生成式AI管理暫定弁法（2023-08施行）の3本柱＋AI生成コンテンツ標識弁法（2025-09施行）で構成。世論動員力のあるサービスに重い義務を課す「世論属性」基準が事実上のリスク分類として機能。",
      "sources": [
        "https://www.cac.gov.cn/2023-07/13/c_1690898327029107.htm"
      ]
    },
    "prohibited_uses": {
      "summary": "生成AIに対しコンテンツ面の禁止（国家安全を害する内容等）を規定。用途型の禁止リストはEUと構造が異なる。",
      "detail": "生成式AI管理暫定弁法第4条が、社会主義核心価値観に反する内容、国家安全・社会安定を害する内容、差別的内容等の生成を禁止。EUが「用途」を禁止するのに対し、中国は「生成されるコンテンツ」を禁止する構造。",
      "sources": [
        "https://www.cac.gov.cn/2023-07/13/c_1690898327029107.htm"
      ]
    },
    "gpai_obligations": {
      "summary": "公衆向け生成AIサービスに事前のセキュリティ評価・アルゴリズム届出（备案）を義務化。",
      "detail": "世論属性・社会動員能力を持つ生成AIサービスは提供前にセキュリティ評価と届出が必要。学習データの適法性、知的財産権の尊重、個人情報の同意取得も義務。基盤モデル自体の届出制度として運用され、当局公表の届出済みモデルリストが市場参入の前提となっている。",
      "sources": [
        "https://www.cac.gov.cn/2023-07/13/c_1690898327029107.htm"
      ]
    },
    "transparency": {
      "summary": "AI生成コンテンツへの明示的・暗黙的ラベル付けを義務化（標識弁法、2025-09施行）。世界で最も具体的な表示規制。",
      "detail": "AI生成合成コンテンツ標識弁法（2025-09-01施行）により、テキスト・画像・音声・動画・仮想シーンに対し、ユーザーに見える明示的ラベルとメタデータへの暗黙的ラベルの両方を義務付け。プラットフォームには検出・表示義務、アプリストアには確認義務。",
      "sources": [
        "https://www.cac.gov.cn/2025-03/14/c_1743654684782215.htm"
      ]
    },
    "penalties": {
      "summary": "既存法（ネット安全法・データ安全法・個人情報保護法）の罰則を準用。サービス停止・是正命令が主。",
      "detail": "生成式AI暫定弁法自体の罰則は既存法準用＋警告・是正命令・サービス停止。個人情報保護法経由では最大5,000万元または前年売上5%の制裁が可能。実務上は届出拒否・取り下げ・アプリストア削除が強力な執行手段。",
      "sources": [
        "https://www.cac.gov.cn/2023-07/13/c_1690898327029107.htm"
      ]
    },
    "enforcement_body": {
      "summary": "国家インターネット情報弁公室（CAC）が中心。工業情報化部・公安部等と共同管轄。",
      "detail": "CACがアルゴリズム届出・セキュリティ評価・コンテンツ執行を主導し、国家発展改革委員会・教育部・科技部・工信部・公安部・広電総局が共同で所管。地方インターネット情報弁公室が一次対応。",
      "sources": [
        "https://www.cac.gov.cn/"
      ]
    },
    "timeline": [
      {
        "date": "2022-03-01",
        "event": "アルゴリズム推薦管理規定 施行",
        "source": "https://www.cac.gov.cn/2022-01/04/c_1642894606364259.htm"
      },
      {
        "date": "2023-01-10",
        "event": "深度合成（ディープフェイク）管理規定 施行",
        "source": "https://www.cac.gov.cn/2022-12/11/c_1672221949318230.htm"
      },
      {
        "date": "2023-08-15",
        "event": "生成式AI管理暫定弁法 施行",
        "source": "https://www.cac.gov.cn/2023-07/13/c_1690898327029107.htm"
      },
      {
        "date": "2025-09-01",
        "event": "AI生成合成コンテンツ標識弁法 施行",
        "source": "https://www.cac.gov.cn/2025-03/14/c_1743654684782215.htm"
      },
      {
        "date": "2024-09-14",
        "event": "強制国家基準「AI生成コンテンツ標識方法」（GB 44855-2024）公表",
        "source": "https://news.google.com/rss/articles/CBMiX0FVX3lxTE9tVVl1MG53UENCSTZySThWQ1BZajlVLTdCSkRFcUZYMHE5c2VMRTNwa3Zva3ZBQmJQR19GUm8yVmZ2RlZqWnhlaGN1eTI2YkNMTG1VV21jY01sNEhwLXRv?oc=5"
      },
      {
        "date": "2025-07-01",
        "event": "強制国家基準「AI生成コンテンツ標識方法」（GB 44855-2024）施行（の見込み）",
        "source": "https://news.google.com/rss/articles/CBMiX0FVX3lxTE9tVVl1MG53UENCSTZySThWQ1BZajlVLTdCSkRFcUZYMHE5c2VMRTNwa3Zva3ZBQmJQR19GUm8yVmZ2RlZqWnhlaGN1eTI2YkNMTG1VV21jY01sNEhwLXRv?oc=5"
      },
      {
        "date": "2026-09-14",
        "event": "「人工知能安全ガバナンスフレームワーク3.0」の発表",
        "source": "https://www.cac.gov.cn/2026-09/14/c_1791137092283345.htm"
      },
      {
        "date": "2026-09-18",
        "event": "『ネットワーク安全標準実践指南——エージェントシステム開発安全指南（征求意见稿）』公表・パブコメ開始",
        "source": "https://www.tc260.org.cn/tc260/tzgg/202609/e5b82ae7aca244d19d36b39575cbb458.shtml"
      }
    ]
  },
  "diff_vs_eu": {
    "stricter": [
      {
        "topic": "事前届出・セキュリティ評価",
        "note": "公衆向け生成AIは提供前に届出（备案）と評価が必要。EUの事後監督型より参入規制が強い",
        "source": "https://www.cac.gov.cn/2023-07/13/c_1690898327029107.htm"
      },
      {
        "topic": "合成コンテンツ表示",
        "note": "明示・暗黙の二重ラベル＋プラットフォーム検出義務＋アプリストア確認義務まで規定し、EU第50条より具体的で広い",
        "source": "https://www.cac.gov.cn/2025-03/14/c_1743654684782215.htm"
      }
    ],
    "looser": [
      {
        "topic": "横断的リスク分類",
        "note": "EU型の4階層・ハイリスク義務体系はなく、サービス類型別規則の積み上げ",
        "source": "https://www.cac.gov.cn/2023-07/13/c_1690898327029107.htm"
      }
    ],
    "absent": [
      {
        "topic": "用途型禁止リスト",
        "note": "EU第5条のような社会的スコアリング等の用途禁止はない（むしろ社会信用システムは政策として存在）",
        "source": "https://www.cac.gov.cn/2023-07/13/c_1690898327029107.htm"
      }
    ],
    "unique": [
      {
        "topic": "コンテンツ価値観統制",
        "note": "生成内容が社会主義核心価値観に適合することを求める、政治体制由来の独自要件",
        "source": "https://www.cac.gov.cn/2023-07/13/c_1690898327029107.htm"
      },
      {
        "topic": "届出済みモデルリスト",
        "note": "当局公表のモデル届出リストが事実上の市場参入許可として機能",
        "source": "https://www.cac.gov.cn/"
      }
    ]
  },
  "last_checked": "2026-10-15T09:15:39Z",
  "last_changed": "2026-09-18T23:11:51Z"
}
