{
  "jurisdiction": "eu",
  "regulation_name": "EU AI Act（規則(EU) 2024/1689）",
  "status": "in_force",
  "approach": "risk_based",
  "is_baseline": true,
  "axes": {
    "risk_classification": {
      "summary": "リスクベース4階層（許容不能・ハイリスク・限定リスク・最小リスク）で義務を段階化。",
      "detail": "許容不能リスクは全面禁止（第5条）。ハイリスクはAnnex I（規制対象製品の安全部品）とAnnex III（雇用・教育・法執行等の分野列挙）の2系統で指定され、リスク管理・データガバナンス・技術文書・人間による監督・適合性評価が義務付けられる。2026-05-19にハイリスク分類のドラフトガイドラインが公表され、Digital Omnibus（Regulation (EU) 2026/1744、2026-07-27発効）による修正でAnnex III系の適用は2027-12-02、Annex I系は2028-08-02へ延期された。この延期により、Annex III系が本来適用されるはずだった2026-08-02の一般適用日には実質的にハイリスク義務は発効していない。同改正で機械（機械規則 (EU) 2023/1230）はAnnex IのセクションAからセクションBへ移り、セクションBの製品（自動車・航空・鉄道・機械等）にはAI Actのうち第6条1項・第60a条・第102〜112条等だけが直接適用され、ハイリスク要件は各分野の法令を通じて反映される（改正後の第2条2項）。「安全部品」の定義も絞られ、安全に関わらない補助・最適化・利便性のためだけのAIは安全部品に当たらないとされた（第3条14号・第6条1a項）。",
      "sources": [
        "https://eur-lex.europa.eu/eli/reg/2024/1689/oj",
        "https://eur-lex.europa.eu/eli/reg/2026/1744/oj",
        "https://digital-strategy.ec.europa.eu/en/policies/regulatory-framework-ai",
        "https://www.gibsondunn.com/eu-ai-act-omnibus-agreement-postponed-high-risk-deadlines-and-other-key-changes/"
      ]
    },
    "prohibited_uses": {
      "summary": "第5条で社会的スコアリング、無差別な顔画像収集、職場・教育での感情認識等を禁止（2025-02-02から適用）。2026-12-02から、同意のない性的ディープフェイクや児童性的虐待素材を生成するAIの禁止が加わる。",
      "detail": "禁止対象：サブリミナル等の操作的手法、脆弱性の悪用、公的・私的な社会的スコアリング、個人の犯罪リスク予測（プロファイリングのみに基づくもの）、顔認識DB構築のための無差別スクレイピング、職場・教育機関での感情推定、センシティブ属性を推測する生体分類、法執行目的の公共空間でのリアルタイム遠隔生体識別（限定例外あり）。Digital Omnibus（Regulation (EU) 2026/1744）で第5条1項(ba)(bb)が追加され、本人の明確な同意なく特定可能な人物の性的な画像・映像・音声等を生成・加工するAIと、児童性的虐待素材を生成・加工するAIが2026-12-02から禁止される（市場投入の禁止は、それが意図された用途である場合か、予見可能で再現可能なのに確実に防ぐ安全対策がない場合に限る。第5条1a項）。",
      "sources": [
        "https://eur-lex.europa.eu/eli/reg/2024/1689/oj",
        "https://eur-lex.europa.eu/eli/reg/2026/1744/oj"
      ]
    },
    "gpai_obligations": {
      "summary": "汎用AI（GPAI）モデルに技術文書・下流提供者への情報提供・著作権方針・学習データ概要の公表を義務化（2025-08-02から適用）。",
      "detail": "全GPAIモデル提供者に技術文書整備、下流への情報提供、EU著作権法遵守方針、学習コンテンツの「十分に詳細な要約」公表を義務付け。システミックリスク該当モデル（学習計算量10^25 FLOP超が推定基準）にはモデル評価・敵対的テスト・重大インシデント報告・サイバーセキュリティ対策が追加。GPAI実践規範（Code of Practice）が2025-07-10に公表され署名方式で運用。2025-08-02より前に市場投入されたモデルは2027-08-02までに対応（第111条3項）。欧州委員会は2026-08-02から罰金（第101条: 1,500万ユーロまたは全世界売上高3%の高い方）を含めて執行できる。",
      "sources": [
        "https://eur-lex.europa.eu/eli/reg/2024/1689/oj",
        "https://digital-strategy.ec.europa.eu/en/policies/ai-office",
        "https://digital-strategy.ec.europa.eu/en/faqs/guidelines-obligations-general-purpose-ai-providers",
        "https://digital-strategy.ec.europa.eu/en/policies/contents-code-gpai"
      ]
    },
    "transparency": {
      "summary": "第50条でAIとの対話の開示、合成コンテンツ（ディープフェイク）の機械可読な表示・ラベリングを義務化。",
      "detail": "チャットボット等はAIであることの開示、合成音声・画像・映像・テキストは機械可読形式でのマーキング、ディープフェイクはその旨の明示が必要。感情認識・生体分類システムの導入者は対象者への通知義務（職場・教育での感情推定はそもそも第5条で禁止）。適用は2026-08-02（第113条により、個別の適用日指定がない条項に自動的に適用される「本則の一般適用日」）。この日にはAnnex IIIハイリスク義務も本来同じ一般適用日で発効する予定だったが、Digital Omnibus（Regulation (EU) 2026/1744、2026-07-27発効）で2027-12-02へ個別延期されたため、2026-08-02に予定通り実際に発効した実質的な義務は第50条の透明性義務が中心となっている。なお、2026-08-02より前に市場投入された生成AIシステムの提供者は、第50条2項の機械可読表示を2026-12-02までに整えればよい（同改正で新設の第111条4項）。",
      "sources": [
        "https://eur-lex.europa.eu/eli/reg/2024/1689/oj",
        "https://eur-lex.europa.eu/eli/reg/2026/1744/oj",
        "https://artificialintelligenceact.eu/article/113/",
        "https://artificialintelligenceact.eu/transparency-rules-article-50/"
      ]
    },
    "penalties": {
      "summary": "最大3,500万ユーロまたは全世界売上高7%（禁止行為違反）。義務違反は1,500万ユーロ/3%。",
      "detail": "第99条。禁止行為（第5条）違反：最大3,500万ユーロまたは前会計年度全世界売上高の7%のいずれか高い方。その他の義務違反：1,500万ユーロ/3%。当局への不正確な情報提供：750万ユーロ/1%。中小企業には低い方を適用する配慮規定あり。Digital Omnibus（Regulation (EU) 2026/1744）で中堅企業（SMC）にも1,500万ユーロ/3%・750万ユーロ/1%の区分で低い方を適用（第99条6a項）。GPAIモデル提供者には欧州委員会が1,500万ユーロまたは3%の高い方を上限に罰金を科せる（第101条、2026-08-02から）。",
      "sources": [
        "https://eur-lex.europa.eu/eli/reg/2024/1689/oj",
        "https://eur-lex.europa.eu/eli/reg/2026/1744/oj"
      ]
    },
    "enforcement_body": {
      "summary": "欧州委員会内のAI Office（GPAI監督）＋各加盟国の市場監視当局の二層構造。",
      "detail": "AI OfficeがGPAIモデルを直接監督し、実践規範を策定。各加盟国は2025-08-02までに市場監視当局・通知当局を指定。European AI Board（加盟国代表）が一貫適用を調整。科学パネルがシステミックリスク評価を支援。Digital Omnibus（Regulation (EU) 2026/1744）で、同じ提供者（グループ）がGPAIモデルとAIシステムの両方を開発する場合のAIシステム（Annex I製品関連・Annex III第2号等を除く）と、超大規模オンラインプラットフォーム・検索エンジンに組み込まれたAIシステムについて、AI Officeが専属で監督・執行（調査・罰金・履行強制金）する権限が加わった（改正後の第75条1項、第75a〜75d条）。",
      "sources": [
        "https://digital-strategy.ec.europa.eu/en/policies/ai-office",
        "https://eur-lex.europa.eu/eli/reg/2026/1744/oj"
      ]
    },
    "timeline": [
      {
        "date": "2024-08-01",
        "event": "AI Act発効",
        "source": "https://eur-lex.europa.eu/eli/reg/2024/1689/oj"
      },
      {
        "date": "2025-02-02",
        "event": "禁止行為（第5条）・AIリテラシー義務の適用開始",
        "source": "https://eur-lex.europa.eu/eli/reg/2024/1689/oj"
      },
      {
        "date": "2025-08-02",
        "event": "GPAI義務・ガバナンス規定・罰則の適用開始",
        "source": "https://eur-lex.europa.eu/eli/reg/2024/1689/oj"
      },
      {
        "date": "2026-05-19",
        "event": "ハイリスクAI分類のドラフトガイドライン公表",
        "source": "https://digital-strategy.ec.europa.eu/en/policies/regulatory-framework-ai"
      },
      {
        "date": "2027-12-02",
        "event": "Annex III系ハイリスク義務の適用開始（Digital Omnibusで延期後）",
        "source": "https://digital-strategy.ec.europa.eu/en/policies/regulatory-framework-ai"
      },
      {
        "date": "2028-08-02",
        "event": "Annex I系ハイリスク義務の適用開始（Digital Omnibusで延期後）",
        "source": "https://digital-strategy.ec.europa.eu/en/policies/regulatory-framework-ai"
      },
      {
        "date": "2026-06-01",
        "event": "欧州委員会が諮問フォーラム（Advisory Forum）のメンバー174名を任命・発表",
        "source": "https://artificialintelligenceact.eu/the-advisory-forum-what-is-it-and-how-does-it-work/"
      },
      {
        "date": "2026-07-27",
        "event": "Digital Omnibus（Regulation (EU) 2026/1744）発効。Annex IIIハイリスク義務の延期（2027-12-02）が正式に確定",
        "source": "https://eur-lex.europa.eu/eli/reg/2026/1744/oj"
      },
      {
        "date": "2026-08-02",
        "event": "本則の一般適用日。第50条の透明性義務（AI開示・合成コンテンツ表示・ディープフェイク明示）が発効。同日発効予定だったAnnex IIIハイリスク義務はDigital Omnibusで既に延期済みのため対象外",
        "source": "https://artificialintelligenceact.eu/article/113/"
      },
      {
        "date": "2026-12-02",
        "event": "Digital Omnibusで追加された禁止（第5条1項(ba)(bb): 同意のない性的ディープフェイク・児童性的虐待素材を生成するAI）の適用開始。2026-08-02前に市場投入された生成AIの第50条2項（機械可読表示）の猶予も終了",
        "source": "https://eur-lex.europa.eu/eli/reg/2026/1744/oj"
      },
      {
        "date": "2027-08-02",
        "event": "2025-08-02前に市場投入されたGPAIモデルの義務対応期限（第111条3項）",
        "source": "https://eur-lex.europa.eu/eli/reg/2024/1689/oj"
      }
    ]
  },
  "last_checked": "2026-10-18T08:57:27Z",
  "last_changed": "2026-10-11T12:00:00Z"
}
