{
  "jurisdiction": "kz",
  "regulation_name": "人工知能法（Закон «Об искусственном интеллекте», No. 230-VIII）",
  "status": "in_force",
  "approach": "risk_based",
  "axes": {
    "risk_classification": {
      "summary": "AIシステムを、機能停止・障害が及ぼす影響の大きさで最小・中・高リスクの3段階に分け、所有者・保有者が自ら分類する（第17条1項）。これとは別に、人による修正の可否で自律性を低・中・高に分ける（同2項）。",
      "detail": "第17条1項は、障害・停止の影響が利用者に最小にとどまるものを最小リスク、業務効率の低下や精神的・物的損害を招き得るものを中リスク、社会的・技術的な緊急事態や国防・安全・経済・インフラ・人の生活への重大な悪影響を招き得るものを高リスクとし、分類は所有者・保有者がデジタル対象の分類規則に従って行う。重要なデジタル対象に当たる高リスクAIと国家デジタル資源を形成するAIは、サイバーセキュリティ要件の面で国家システムと同等に扱われる。第15条2項は所有者・保有者に、リスク管理、安全性・信頼性の確保、影響度に応じた文書の整備（授権機関が定める文書一覧による）を求め、第18条はライフサイクルを通じたリスク管理（少なくとも年1回の見直し）と、禁止機能のリスクを見つけた場合の運用停止を含む即時の措置を定める。第19条により、業種所管の官庁が「信頼できる高リスクAIシステム」の一覧を作って公表し、載りたい所有者・保有者は監査を受ける（第20条。学習データの質と適法性、禁止機能の有無も監査の対象）。自律性の3区分（第17条2項）では、人が修正・取り消しできない高自律システムの特則を別の法律に委ねている。EUのような用途別の附属書、適合性評価、CEマーク、EUデータベースへの登録はない。",
      "sources": [
        "https://prg.kz/document/?doc_id=34207749",
        "https://zakon.mybuh.kz/rus/docs/z2500000230",
        "https://old.adilet.zan.kz/rus/docs/Z2500000230/info"
      ]
    },
    "prohibited_uses": {
      "summary": "第17条3項が、操作的手法、脆弱性の悪用、社会的スコアリング、差別目的の生体分類、同意のない感情認識などの機能を持つAIの開発と運用を国内で禁止する。EU第5条と重なる部分が多いが、遠隔生体識別と顔画像の無差別収集の禁止はない。",
      "detail": "第17条3項が禁止するのは、(1)人の行動をゆがめ、判断能力を奪う潜在意識的・操作的な手法、(2)年齢・障害・社会的地位などによる弱みにつけこんで害を与えること、(3)社会的な行動や個人の特性に基づく一定期間にわたる評価・分類（法律に定めがある場合は除く）、(4)個人データ保護法に違反するデータの収集・処理、(5)人種・政治的見解・宗教などを推定する生体データによる差別目的の分類、(6)本人の同意のない感情の判定（法律に定めがある場合は除く）、(7)法律で禁じられた生成物の作成・流布。EU第5条にある、法執行目的の公共空間でのリアルタイム遠隔生体識別、顔認識データベースのための無差別スクレイピング、プロファイリングだけに基づく犯罪リスク予測は、条文に出てこない。感情認識はEUのように職場・教育に限らず、同意がなければ全般に禁止される。",
      "sources": [
        "https://prg.kz/document/?doc_id=34207749",
        "https://zakon.mybuh.kz/rus/docs/z2500000230",
        "https://astanatimes.com/2025/11/kazakhstan-adopts-central-asias-first-ai-law/"
      ]
    },
    "gpai_obligations": {
      "summary": "汎用AIモデル（基盤モデル）という区分と、それに向けた個別の義務はない。モデルの学習には、著作権の機械可読な拒否表示を尊重させるルール（第23条）とデータライブラリの規定（第27条）が全モデルに及ぶ。",
      "detail": "第1条の定義に汎用AI・基盤モデル・システミックリスク・計算量の基準はなく、モデル（第1条8号）は専門的なタスク向けのソフトウェアとしか定義されていない。学習については、第23条3項が作品を学習に使うことを教育・研究目的の自由利用には当たらないとし、同5項が、作者・権利者が機械可読な形で禁止していない場合に限って学習への利用を認める。第27条は、学習を目的が適法で事前に定められたデータライブラリで行うこと（3項）と、データライブラリの作成者情報を機械可読な形で示すこと（5項）を定める。EUのGPAIに課される技術文書、下流の提供者への情報提供、学習データの要約公表に当たる義務は見当たらない。",
      "sources": [
        "https://prg.kz/document/?doc_id=34207749",
        "https://zakon.mybuh.kz/rus/docs/z2500000230"
      ]
    },
    "transparency": {
      "summary": "AIを使って作られた・提供される商品やサービスの全般について利用者への告知を求め（第21条1項）、合成生成物は機械可読なマーキングと目に見える警告の両方がなければ流布できない（同2項）。",
      "detail": "第21条1項は、商品・作業・サービスがAIを使って作られた、または提供されることを利用者に知らせるよう求める。同2項は、合成生成物（第1条4号: 実在の人物の外見・声・振る舞いや、起きていない出来事を模した画像・動画・音声・文章）の流布を、機械可読な形のマーキングと、利用者が無理なく気づける目に見える警告などを付けた場合に限る。告知の責任はAIシステムの所有者・保有者が負う（同3項）。自動処理だけに基づく決定は個人データ保護法に委ねる（同4項）。利用者には、権利に影響する結果について説明を受ける権利、判断の根拠データを問い合わせる権利、法律で義務とされていない場合にAIとのやり取りを断る権利がある（第16条1項4〜6号）。機械可読形式の手続は授権機関が定める（第22条）。同時に改正されたマスメディア法第14条7項は、AIで作ったメディア製品の流布をAI法に沿った告知を条件とする（報道で確認）。",
      "sources": [
        "https://prg.kz/document/?doc_id=34207749",
        "https://zakon.mybuh.kz/rus/docs/z2500000230",
        "https://www.zakon.kz/pravo/6504703-novye-shtrafy-za-nezakonnoe-ispolzovanie-iskusstvennogo-intellekta-poyavyatsya-v-kazakhstane.html",
        "https://www.uapz.kz/v-kazahstane-vvoditsya-administrativnaya-i-ugolovnaya-otvetstvennost-za-nezakonnoe-ispolzovanie-iskusstvennogo-intellekta/"
      ]
    },
    "penalties": {
      "summary": "行政違反法典（КоАП）に新設された第641-1条で、合成生成物の告知を怠ることと、高リスクAIでリスク管理を怠り被害を出すことに、最大100MRP（2026年で43万2,500テンゲ）の罰金を科す（報道で確認）。",
      "detail": "AI法第30条は、違反の責任を他の法律に委ねる。報道によると、AI法と同時に施行されたКоАП第641-1条は、(1)所有者・保有者が、誤認を招き得る合成生成物について利用者への告知を怠ること、(2)高リスクAIのリスク管理を怠り、健康への悪影響、禁止情報や虚偽情報の作成・流布、差別、人権侵害などの害を出すこと（犯罪に当たらない場合）を対象に、個人15、小規模事業者・非営利団体20、中規模事業者30、大規模事業者100MRPの罰金を定め、1年以内の再犯で倍になる。報道は、AIで作ったことを示さないコンテンツが虚偽情報としてКоАП第456-2条の対象になり得ること、重大な害があれば刑法第274条の対象になり得ることも伝えている。損害の賠償は民法典に従い、賠償責任保険は法律に委ねる（AI法第24条）。EUのような売上に連動する上限額はない。",
      "sources": [
        "https://www.zakon.kz/pravo/6504703-novye-shtrafy-za-nezakonnoe-ispolzovanie-iskusstvennogo-intellekta-poyavyatsya-v-kazakhstane.html",
        "https://www.uapz.kz/v-kazahstane-vvoditsya-administrativnaya-i-ugolovnaya-otvetstvennost-za-nezakonnoe-ispolzovanie-iskusstvennogo-intellekta/",
        "https://prg.kz/document/?doc_id=34207749"
      ]
    },
    "enforcement_body": {
      "summary": "授権機関（中央の執行機関）が戦略・規制・実施・監督の機能を持ち、人工知能・デジタル発展省（MAIDD）がこの役割を担っているとみられる。業種所管の官庁が「信頼できる高リスクAI」の一覧を、政府が指定する運営者が国家AIプラットフォームを受け持つ。",
      "detail": "第13条1項は、授権機関に戦略・規制・実施・監督の機能、規則の制定、AI文書一覧とAIシステムに当たるかどうかの基準の承認を与える。政府は政策の大枠を決め、国家AIプラットフォームの運営者とAI導入の優先分野を指定する（第12条）。国家AIプラットフォームは、モデルや製品を一定の期間開発・学習・試験運用できる管理された環境（第25条）で、運営者が計算資源を提供する（第26条）。法文を収めた民間法令DBの注記には、MAIDDによるAI監査書類の要件についての書簡（2026-05-05）や、MAIDDの委員会による解釈の書簡が載っている。施行措置については首相令 No.2-р（2026-01-14）がある。EUのAI Officeや市場監視当局、適合性評価機関に当たる仕組みや、重大インシデントの報告義務は法にない。",
      "sources": [
        "https://prg.kz/document/?doc_id=34207749",
        "https://www.gov.kz/memleket/entities/maidd?lang=en",
        "https://astanatimes.com/2025/11/kazakhstan-adopts-central-asias-first-ai-law/"
      ]
    },
    "timeline": [
      {
        "date": "2025-11-17",
        "event": "トカエフ大統領が人工知能法 No.230-VIII に署名",
        "source": "https://astanatimes.com/2025/11/kazakhstan-adopts-central-asias-first-ai-law/"
      },
      {
        "date": "2026-01-14",
        "event": "首相令 No.2-р（人工知能法の施行措置）",
        "source": "https://prg.kz/document/?doc_id=34207749"
      },
      {
        "date": "2026-01-18",
        "event": "人工知能法が施行（公式公表から60日後に施行と定める第31条による）",
        "source": "https://prg.kz/document/?doc_id=34207749"
      },
      {
        "date": "2026-08-25",
        "event": "法 No.326-VIII（2026-06-24署名）による改正が施行。「情報化対象」を「デジタル対象」に改めるなど用語を変更（第1条5号・第13条・第17条1項・第20条1項・第28条）",
        "source": "https://adilet.zan.kz/rus/docs/Z2600000326"
      }
    ]
  },
  "diff_vs_eu": {
    "stricter": [
      {
        "topic": "AI利用の告知の範囲",
        "note": "第21条1項は、AIを使って作られた・提供される商品やサービス全般について利用者への告知を求める。EU第50条は、AIとの直接のやり取り、合成コンテンツ、ディープフェイクなどに限られる",
        "source": "https://prg.kz/document/?doc_id=34207749"
      },
      {
        "topic": "合成生成物の二重表示",
        "note": "合成生成物は、機械可読なマーキングと目に見える警告の両方がないと流布できない（第21条2項）。EUでは、機械可読な表示は提供者（第50条2項）、ディープフェイクの開示は実施者（同4項）と分かれている",
        "source": "https://prg.kz/document/?doc_id=34207749"
      },
      {
        "topic": "感情認識の禁止範囲",
        "note": "同意のない感情の判定を、場面を限らず禁止する（第17条3項6号。法律に定めがある場合は除く）。EUの禁止は職場と教育機関に限られる（第5条1項(f)）",
        "source": "https://prg.kz/document/?doc_id=34207749"
      }
    ],
    "looser": [
      {
        "topic": "禁止用途の範囲",
        "note": "法執行目的のリアルタイム遠隔生体識別、顔画像の無差別スクレイピング、プロファイリングだけに基づく犯罪予測の禁止はない。社会的スコアリングと感情認識の禁止には「法律に定めがある場合」の例外がある",
        "source": "https://prg.kz/document/?doc_id=34207749"
      },
      {
        "topic": "高リスクAIの手続",
        "note": "分類は所有者・保有者が自ら行い、適合性評価、CEマーク、データベースへの登録はない。監査は「信頼できる一覧」への掲載を望む場合に限られる（第17条・第19条）",
        "source": "https://prg.kz/document/?doc_id=34207749"
      },
      {
        "topic": "制裁金の水準",
        "note": "КоАП第641-1条の上限は100MRP（2026年で43万2,500テンゲ、再犯で倍）。EUの3,500万ユーロまたは売上の7%と比べて大幅に低い（報道で確認）",
        "source": "https://www.zakon.kz/pravo/6504703-novye-shtrafy-za-nezakonnoe-ispolzovanie-iskusstvennogo-intellekta-poyavyatsya-v-kazakhstane.html"
      }
    ],
    "absent": [
      {
        "topic": "汎用AI（基盤モデル）規制",
        "note": "汎用AI、システミックリスク、計算量の基準を定めた規定がない",
        "source": "https://prg.kz/document/?doc_id=34207749"
      },
      {
        "topic": "重大インシデントの報告",
        "note": "当局に報告する義務がない。禁止機能のリスクを見つけたときに自ら停止などの措置をとる義務だけがある（第18条2項）",
        "source": "https://prg.kz/document/?doc_id=34207749"
      },
      {
        "topic": "域外提供者の代理人",
        "note": "国外の提供者に国内の代理人や連絡窓口を置かせる規定がない",
        "source": "https://prg.kz/document/?doc_id=34207749"
      }
    ],
    "unique": [
      {
        "topic": "自律性の3区分",
        "note": "リスク分類とは別に、人が修正・取り消しできるかどうかで自律性を低・中・高に分け、高自律システムの特則は別の法律に委ねる（第17条2項）",
        "source": "https://prg.kz/document/?doc_id=34207749"
      },
      {
        "topic": "公開型・閉鎖型・ローカル型の区分",
        "note": "アクセスが法律で制限されたデータの処理には、ローカル（公衆網につながない）システムを使う（第17条4項）",
        "source": "https://prg.kz/document/?doc_id=34207749"
      },
      {
        "topic": "学習とAI生成物の著作権",
        "note": "著作権で守られるのは人の創作的な寄与がある作品だけ。プロンプトも著作物になり得る。学習への利用は、権利者が機械可読な形で禁止していない場合に限る（第23条）",
        "source": "https://prg.kz/document/?doc_id=34207749"
      },
      {
        "topic": "信頼できる高リスクAIの一覧",
        "note": "業種所管の官庁が、監査を経たシステムを「信頼できる」一覧として公表する任意の仕組み（第19条）",
        "source": "https://prg.kz/document/?doc_id=34207749"
      },
      {
        "topic": "国家AIプラットフォームとデータライブラリ",
        "note": "政府が指定する運営者が、開発・試験環境と計算資源を提供し、データライブラリの作成者情報は機械可読な形で示す（第25〜27条）",
        "source": "https://prg.kz/document/?doc_id=34207749"
      },
      {
        "topic": "AIとのやり取りを断る権利",
        "note": "法律で義務とされていない場合、利用者はAIシステムとのやり取りを断れる（第16条1項6号）",
        "source": "https://prg.kz/document/?doc_id=34207749"
      }
    ]
  },
  "last_checked": "2026-10-31T00:00:00Z",
  "last_changed": "2026-10-31T00:00:00Z"
}
