{
  "jurisdiction": "ru",
  "regulation_name": "連邦法 No.243-FZ「ロシア連邦における人工知能技術の発展支援について」（Федеральный закон от 26.07.2026 № 243-ФЗ «О поддержке развития технологий искусственного интеллекта в Российской Федерации»）",
  "status": "in_force",
  "approach": "sectoral",
  "axes": {
    "risk_classification": {
      "summary": "EUのような段階的なリスク分類はない。法は「リスク指向の規制」を原則に掲げ（第4条5号）、政府が分野ごとにリスク防止の要件を定められる（第5条2項4号、2027-03-01施行）。",
      "detail": "連邦法243-FZの対象は「大規模基盤AIモデル」の開発・導入・利用だけ（第1条1項）。大規模基盤モデルは、10億以上のパラメータを持ち、多くのタスクに使われるものと定義される（第3条2号）。第4条5号は、利用の要件を害の確率と規模に応じて定める「リスク指向のアプローチ」を規制原則とする。害の対象には、生命・健康、名誉・財産、国家の技術的独立、環境などが挙がる。具体的な区分は法になく、政府が各分野で使う大規模基盤モデルのリスク防止要件を定められる（第5条2項4号。金融分野は中央銀行と協議）。この規定は2027-03-01施行（第13条2項）。リスク区分の代わりに、法は「主権モデル」「国家モデル」という地位を設ける。どちらも国内法人の開発、国内データセンターでの運用、法令と「伝統的なロシアの精神的・道徳的価値」への適合確認が要件（第6条2〜3項、2027-03-01施行）。国防・治安・公共秩序・行政などの目的については、連邦法・大統領令で特則を置ける（第1条3項）。",
      "sources": [
        "https://base.garant.ru/414652934/1cafb24d049dcd1e7707a22d98e9858f/",
        "https://base.garant.ru/414652934/5ac206a89ea76855804609cd950fcaf7/",
        "https://base.garant.ru/414652934/1b93c134b90c6071b4dc3f495464b753/",
        "https://base.garant.ru/414652934/5633a92d35b966c2ba2f1e859e7bdd69/",
        "https://base.garant.ru/414652934/8b7b3c1c76e91f88d33c08b3736aa67a/",
        "https://base.garant.ru/414652934/4d6cc5b8235f826b2c67847b967f8695/"
      ]
    },
    "prohibited_uses": {
      "summary": "AI固有の禁止用途の規定はない。違反は既存の法令に従って責任を問うとするだけ（第11条）。",
      "detail": "243-FZの条文（第1〜13条）には、EU第5条にある禁止類型を定める条がない。社会的スコアリング・感情推定・遠隔生体識別なども同様。第4条は原則として、人の権利・自由の確保（3号）、人の自律と自由意思の尊重（4号）、憲法秩序・国防・国家安全などへの脅威の防止（9号）を掲げるにとどまる。政府は、主権・国家モデルだけを使わせる場合を定められる（第5条2項3号）。ただしこれは用途の禁止ではなく、使うモデルの出所の制限。",
      "sources": [
        "https://base.garant.ru/414652934/",
        "https://base.garant.ru/414652934/1b93c134b90c6071b4dc3f495464b753/",
        "https://base.garant.ru/414652934/5633a92d35b966c2ba2f1e859e7bdd69/",
        "https://base.garant.ru/414652934/9d78f2e21a0e8d6e5a75ac4e4a939832/"
      ]
    },
    "gpai_obligations": {
      "summary": "法の対象そのものが大規模基盤モデル（10億パラメータ以上）。ただし安全措置・運用規則・技術文書の義務を負うのは、主権・国家モデルの開発者だけ（第8条、2027-03-01施行）。",
      "detail": "第3条2号の大規模基盤モデルは、人と同等以上の水準で知的タスクを行い、各種ソフトウェアの基盤となるプログラム。10億以上のパラメータを持ち、多くのタスクに使われるものに限る。第8条は主権・国家モデルの開発者に3つの義務を課す。安全確保の組織的・技術的措置、利用の制限・条件・更新・廃止を定める運用規則、安全性評価に必要な範囲で主要パラメータと制約を記す技術文書。主権モデルの要件は、国内法人が全ライフサイクルを開発し、学習を含めて技術的に完全に再現できること（第6条2項）。国家モデルの要件は、国内法人が主要な特性を決め、外部の部品はオープンライセンスであること（第6条3項）。どちらも、国内法人が所有する国内データセンターでの応答生成とデータ保存が必要。政府の定める手順で、法令と伝統的価値への適合確認も受ける。「国内法人」は、国・地方・二重国籍でない国民が議決権の50%超を支配する法人（第6条4項）。主権・国家モデルの学習に限り、著作物の解析と一時的な複製を著作権侵害としない（第10条2項）。対象は適法に入手した著作物か、技術的な制限なく公開された著作物。確認できた条文に、EUのような学習データ概要の公表、システミックリスク評価、計算量基準はない。",
      "sources": [
        "https://base.garant.ru/414652934/5ac206a89ea76855804609cd950fcaf7/",
        "https://base.garant.ru/414652934/8b7b3c1c76e91f88d33c08b3736aa67a/",
        "https://base.garant.ru/414652934/31de5683116b8d79b08fa2d768e33df6/",
        "https://base.garant.ru/414652934/3d3a9e2eb4f30c73ea6671464e2a54b5/",
        "https://base.garant.ru/414652934/4d6cc5b8235f826b2c67847b967f8695/"
      ]
    },
    "transparency": {
      "summary": "大規模基盤モデルを利用させる者に、生成物の権利の帰属と利用条件を利用者へ通知させる（第10条1項）。生成物の表示（第9条）も2027-03-01施行だが、中身は報道で割れる。",
      "detail": "第10条1項の通知義務は2027-03-01施行。通知するのは、モデルで得た知的成果の権利の帰属と、利用者がそれにアクセス・利用・保存できる条件。第9条の見出しは「大規模基盤AIモデルを用いて作成された情報素材の表示」（法本文の目次で確認）。大統領府の発表は、法が生成コンテンツの表示要件を導入すると説明する。報道では、1日の利用者が50万人を超えるSNS・メディア・マーケットプレイス等に、利用者がAI生成物にラベルを付けられる機能を求めるとされる。一方で、生成物への表示を一律に義務付けるものではないとする解説もある。第9条の条文本文は未確認。EU第50条のAIとの対話の告知は、読めた条文（第9条を除く）にない。提供者による機械可読マーキングが第9条にあるかは未確認。",
      "sources": [
        "https://base.garant.ru/414652934/3d3a9e2eb4f30c73ea6671464e2a54b5/",
        "https://base.garant.ru/414652934/4d6cc5b8235f826b2c67847b967f8695/",
        "http://en.kremlin.ru/acts/news/80377",
        "https://pravo.ru/news/264955/",
        "https://meduza.io/en/news/2026/07/08/russia-s-state-duma-passes-law-regulating-ai-requiring-respect-for-traditional-russian-values",
        "https://www.nordicstar.law/en/news/russias-first-law-on-artificial-intelligence/"
      ]
    },
    "penalties": {
      "summary": "法に固有の罰則・制裁金はない。違反者は「ロシア連邦の法令に従い」責任を負うとするだけ（第11条）。",
      "detail": "第11条は、本法と下位規範に違反した関係者が法令に従って責任を負うと定める。金額や処分の種類は定めていない。EU第99条のような売上連動の制裁金もない。本法違反の処罰規定を行政違反法典などに足す改正があるかは未確認。",
      "sources": [
        "https://base.garant.ru/414652934/9d78f2e21a0e8d6e5a75ac4e4a939832/",
        "https://base.garant.ru/414652934/"
      ]
    },
    "enforcement_body": {
      "summary": "AI専属の監督機関はない。政府が連邦機関を調整し、支援策・国産モデル限定の場面・分野別のリスク要件を定める。IT分野の連邦執行機関が分析・方法支援・振興策を担う（第5条）。",
      "detail": "第5条1項により、大統領が国家AI発展戦略を承認する。政府の権限は第5条2項が定める。連邦執行機関の調整、財政・資産・保証・情報面の支援策、主権・国家モデルだけを使う場合とその例外の一覧（金融分野は中央銀行と協議）。分野別のリスク防止要件と、連邦情報システムのデータを学習に提供する手順（安全保障機関と協議）も含む（3〜5号は2027-03-01施行）。第5条3項は、IT分野の政策と規制を担う連邦執行機関に、発展の分析と規制改善策の立案、国・自治体への方法支援、振興策を割り当てる。条文は機関を名指ししない（法案の起草はデジタル発展省）。地域の行政府も、地域の情報システムのデータを学習用に提供できる（第5条5項）。主権・国家モデルの地位の登録・付与の手順は政府が定める（第6条5項）。国産モデル限定の要件には経過措置がある。2027-03-01時点で稼働する大規模基盤モデルを使う情報システムは、データを国内で処理・保存すれば2032-09-01まで対象外（第13条3項）。実験的法制度（連邦法258-FZ）の下では、第3条と第6条に特則を置ける（第13条4項）。",
      "sources": [
        "https://base.garant.ru/414652934/5633a92d35b966c2ba2f1e859e7bdd69/",
        "https://base.garant.ru/414652934/8b7b3c1c76e91f88d33c08b3736aa67a/",
        "https://base.garant.ru/414652934/4d6cc5b8235f826b2c67847b967f8695/",
        "https://meduza.io/en/news/2026/07/08/russia-s-state-duma-passes-law-regulating-ai-requiring-respect-for-traditional-russian-values"
      ]
    },
    "timeline": [
      {
        "date": "2026-07-08",
        "event": "国家院（下院）が法案 No.1271570-8「ロシア連邦における人工知能技術の発展支援について」を可決",
        "source": "https://en.khp.legal/insights/legal-updates/russia-moves-toward-its-first-framework-ai-law"
      },
      {
        "date": "2026-07-17",
        "event": "連邦院（上院）が同法を承認",
        "source": "https://tass.com/politics/2161507"
      },
      {
        "date": "2026-07-26",
        "event": "プーチン大統領が連邦法 No.243-FZ に署名。同日、法令情報公式ポータル（pravo.gov.ru）で公布",
        "source": "http://en.kremlin.ru/acts/news/80377"
      },
      {
        "date": "2026-09-01",
        "event": "243-FZ が施行（定義・原則・大統領と政府の権限など。第5条2項3〜5号、第6条2〜5項、第8〜10条を除く）",
        "source": "https://base.garant.ru/414652934/4d6cc5b8235f826b2c67847b967f8695/"
      },
      {
        "date": "2027-03-01",
        "event": "主権・国家モデルの要件（第6条2〜5項）、国産モデル限定の場面とリスク要件の政府権限（第5条2項3〜5号）、開発者義務（第8条）、生成物の表示（第9条）、利用者への権利通知と学習時の著作物利用（第10条）が施行予定",
        "source": "https://base.garant.ru/414652934/4d6cc5b8235f826b2c67847b967f8695/"
      },
      {
        "date": "2032-09-01",
        "event": "2027-03-01時点で稼働する大規模基盤モデルを使う情報システムへの、国産モデル限定要件の経過措置が終了（データの国内処理・保存が条件）",
        "source": "https://base.garant.ru/414652934/4d6cc5b8235f826b2c67847b967f8695/"
      }
    ]
  },
  "diff_vs_eu": {
    "stricter": [],
    "looser": [
      {
        "topic": "基盤モデル開発者の義務の範囲",
        "note": "安全措置・運用規則・技術文書の義務（第8条）を負うのは主権・国家モデルの開発者だけ。EU第53条はすべての汎用AIモデル提供者に技術文書・下流への情報提供・著作権方針・学習データ概要の公表を求める",
        "source": "https://base.garant.ru/414652934/31de5683116b8d79b08fa2d768e33df6/"
      },
      {
        "topic": "学習での著作物利用",
        "note": "主権・国家モデルの学習に限り、適法に入手したか、技術的な制限なく公開された著作物の解析・一時複製を侵害としない（第10条2項）。権利者の拒否（オプトアウト）への言及はない。EUは汎用AIモデル提供者に、オプトアウトを尊重する著作権方針を求める（第53条1項(c)）",
        "source": "https://base.garant.ru/414652934/3d3a9e2eb4f30c73ea6671464e2a54b5/"
      }
    ],
    "absent": [
      {
        "topic": "禁止用途",
        "note": "EU第5条に当たる禁止類型（社会的スコアリング・感情推定・遠隔生体識別など）の条がない",
        "source": "https://base.garant.ru/414652934/"
      },
      {
        "topic": "リスク階層と高リスクAIの義務",
        "note": "「リスク指向」は原則（第4条5号）と、政府が分野別要件を定める権限（第5条2項4号）だけ。EUのような高リスク指定と適合性評価はない",
        "source": "https://base.garant.ru/414652934/1b93c134b90c6071b4dc3f495464b753/"
      },
      {
        "topic": "制裁金の法定",
        "note": "第11条は既存の法令に従った責任とするだけで、金額を定めない",
        "source": "https://base.garant.ru/414652934/9d78f2e21a0e8d6e5a75ac4e4a939832/"
      },
      {
        "topic": "AI専属の監督機関",
        "note": "AI Officeや市場監視当局に当たる機関を置かない。政府の調整とIT分野の連邦執行機関の分析・振興が中心（第5条）",
        "source": "https://base.garant.ru/414652934/5633a92d35b966c2ba2f1e859e7bdd69/"
      }
    ],
    "unique": [
      {
        "topic": "主権・国家モデルの地位と伝統的価値への適合確認",
        "note": "国内法人の開発と国内データセンターでの運用を要件に、法令と「伝統的なロシアの精神的・道徳的価値」への適合確認を経たモデルに地位を与える（第6条2〜3項、第4条6号）",
        "source": "https://base.garant.ru/414652934/8b7b3c1c76e91f88d33c08b3736aa67a/"
      },
      {
        "topic": "国産モデルだけを使わせる場面の指定",
        "note": "政府が、主権・国家モデルしか使えない場合を定められる（第5条2項3号。金融は中央銀行と協議）。2027-03-01時点で稼働中の情報システムは、データを国内で処理・保存すれば2032-09-01まで対象外（第13条3項）",
        "source": "https://base.garant.ru/414652934/4d6cc5b8235f826b2c67847b967f8695/"
      },
      {
        "topic": "国の情報システムのデータを学習に提供",
        "note": "政府（安全保障機関と協議）と地域の行政府が、国・地域の情報システムのデータを主権・国家モデルの学習に提供する手順を定められる（第5条2項5号・5項）",
        "source": "https://base.garant.ru/414652934/5633a92d35b966c2ba2f1e859e7bdd69/"
      },
      {
        "topic": "生成物の権利の帰属の通知",
        "note": "大規模基盤モデルを利用させる者に、生成物の権利の帰属と利用者がアクセス・利用・保存できる条件を通知させる（第10条1項）",
        "source": "https://base.garant.ru/414652934/3d3a9e2eb4f30c73ea6671464e2a54b5/"
      },
      {
        "topic": "大規模プラットフォームでの利用者ラベル機能（報道ベース・条文未確認）",
        "note": "1日の利用者が50万人を超えるSNS・メディア・マーケットプレイス等に、利用者がAI生成物にラベルを付けられる機能を求めると報じられている（第9条、2027-03-01施行）",
        "source": "https://pravo.ru/news/264955/"
      }
    ]
  },
  "last_checked": "2026-10-31T00:00:00Z",
  "last_changed": "2026-10-31T00:00:00Z"
}
